{
  "job": {
    "slug": "test-fixture-a1b2",
    "source_file": "source/original.mp4",
    "source_type": "video",
    "duration_sec": 22.0,
    "language": "en",
    "media_sha256": "abcdef1234567890abcdef1234567890abcdef1234567890abcdef1234567890",
    "pipeline_version": "1.0",
    "created_utc": "2026-06-15T00:00:00+00:00"
  },
  "stages": {
    "probe": "done",
    "audio": "done",
    "transcribe": "done",
    "frames": "done",
    "manifest": "done",
    "index": "done",
    "proofed": "pending"
  },
  "segments": [
    {"id": "s0001", "t_start": 0.0, "t_end": 4.5, "text": "Welcome to the QuickBooks tutorial.", "no_speech_prob": 0.01, "frame_ids": ["f000001"]},
    {"id": "s0002", "t_start": 4.5, "t_end": 9.2, "text": "Open the chart of accounts.", "no_speech_prob": 0.02, "frame_ids": []},
    {"id": "s0003", "t_start": 9.2, "t_end": 15.8, "text": "Click on the accounts tab to see all entries.", "no_speech_prob": 0.03, "frame_ids": []},
    {"id": "s0004", "t_start": 15.8, "t_end": 22.0, "text": "You can navigate to any account by selecting it here.", "no_speech_prob": 0.01, "frame_ids": []}
  ],
  "frames": [
    {"id": "f000001", "t": 1.0, "path": "frames/f_000001_00-00-01.jpg", "reason": "scene-change", "phash": "abc123"},
    {"id": "f000002", "t": 11.0, "path": "frames/f_000002_00-00-11.jpg", "reason": "interval", "phash": "def456"}
  ],
  "chapters": [
    {
      "id": "c01",
      "title": "Section 1",
      "t_start": 0.0,
      "t_end": 11.0,
      "summary": "Welcome to the QuickBooks tutorial.",
      "keywords": ["quickbooks", "tutorial", "chart", "accounts"],
      "segment_ids": ["s0001", "s0002"],
      "frame_ids": ["f000001"]
    },
    {
      "id": "c02",
      "title": "Section 2",
      "t_start": 11.0,
      "t_end": 22.0,
      "summary": "Click on the accounts tab to see all entries.",
      "keywords": ["accounts", "entries", "navigate", "select"],
      "segment_ids": ["s0003", "s0004"],
      "frame_ids": ["f000002"]
    }
  ]
}
